{
  "summary": "A model is a directory with meta.json and one JSON file per element under kind-specific directories. Coverage ledgers record reviewed tracked paths for a full Git commit.",
  "style": "file",
  "transport": "Repository filesystem under .feynman/model/; element and ledger files are UTF-8 JSON.",
  "server": "model-library",
  "clients": ["modeler-adapter", "model-renderer"],
  "framing": "One JSON object per file; ids are kebab-case filenames and are not duplicated inside elements. Collections load sorted by id.",
  "messages": [
    { "name": "model element", "kind": "record", "summary": "Metadata and typed actor/flow/protocol/state/invariant/claim/limit properties, validated against kind-specific schemas.", "fields": [{ "name": "id", "type": "kebab-case filename", "note": "Element identity is encoded in its path, not body." }] },
    { "name": "coverage ledger", "kind": "record", "summary": "Commit-scoped review evidence used to compute coverage.", "fields": [{ "name": "commit", "type": "40-character Git SHA" }, { "name": "summary", "type": "string" }, { "name": "files", "type": "array", "note": "Each entry has path, outcome and optional note; directory entries only for vendored/generated." }] }
  ],
  "definitions": ["packages/model/schema/"],
  "anchors": ["packages/model/src/model.mjs", "packages/model/schema/meta.json", "packages/model/schema/coverage.json", "packages/model/schema/common.json", "packages/model/schema/actor.json", "packages/model/schema/flow.json", "packages/model/schema/protocol.json", "packages/model/schema/state.json", "packages/model/schema/state-machine.json", "packages/model/schema/invariant.json", "packages/model/schema/claim.json", "packages/model/schema/limit.json"]
}
