{
  "summary": "How a client attaches to a pane: replay, the PTY master descriptor, then live output.",
  "style": "binary",
  "transport": "Unix-domain socket (attach.sock, 0600)",
  "server": "axod",
  "clients": [
    "axo-mac"
  ],
  "framing": "Binary. One request line, then a fixed header, then raw bytes until end of file.",
  "version": "2",
  "messages": [
    {
      "name": "request",
      "kind": "record",
      "from": "axo-mac",
      "summary": "Sent by `axod terminal-attach --shell-id`, once per Ghostty surface. 3 s timeout.",
      "fields": [
        {
          "name": "shellId",
          "type": "decimal",
          "note": "≤19 digits, newline-terminated"
        }
      ]
    },
    {
      "name": "rejection",
      "kind": "record",
      "from": "axod",
      "fields": [
        {
          "name": "marker",
          "type": "u64 BE",
          "note": "u64::MAX"
        },
        {
          "name": "code",
          "type": "u8",
          "note": "DaemonBusy, Other, …"
        }
      ]
    },
    {
      "name": "acceptance",
      "kind": "record",
      "from": "axod",
      "summary": "End of file means the shell exited or the client fell 8 MiB behind; the catalog tells which.",
      "fields": [
        {
          "name": "replayLength",
          "type": "u64 BE",
          "note": "≤8 MiB"
        },
        {
          "name": "descriptor",
          "type": "1 byte + SCM_RIGHTS",
          "note": "PTY master, for input, resize and termios only"
        },
        {
          "name": "stream",
          "type": "bytes",
          "note": "replay followed by live output until EOF"
        }
      ]
    }
  ],
  "anchors": [
    "crates/axo-pty/src/attach.rs",
    "crates/axo-server/src/session.rs#handle_attachment",
    "crates/axod/src/main.rs",
    "apple/AxoRPC/Sources/AxoRPC/TerminalAttachment.swift"
  ]
}
